,text,label
23786,身份证正反面拍照传上去，然后信息填好就行 ,6
23787,我那里短信发不了ipad和手机都不行唉 ,6
23788,那我就不清楚了，你有没有停机呢 ,6
23789,我妈最近也拿这个糖回家说是俄罗斯的 ,6
23790,哈哈~好像是的，还挺好吃的。 ,2
23791,还行吧刚拔完牙也咬不动 ,6
23792,她一只很棒，不断学新东西，有被歌剧惊艳到吗 ,2
23793,有的！唱功超级好很棒！ ,2
23794,所以那些黑子黑她没唱功的，也只有没看过演唱会的才信。 ,5
23795,一直在跳舞但歌声还是很稳太厉害啦 ,2
23796,孕妇体热，正常，我也是别人正常的情况下，我狂热 ,6
23797,正常就好，你咋还没生呢 ,6
23798,没到日子啊，估计还有个一周吧 ,6
23799,歌是自己选的自己唱的，场子气氛是自己搞得，发挥不好怪谁？这是比赛，没有如果。 ,5
23800,你在现场？你知道气氛不好？你是评委？ ,5
23801,你也不是评委吧？那就尊重评委意见咯 ,5
23802,我是真的好想练也真的不怕练，可是腰突严重为了不瘫不得不休息，看到人家去举铁自己不能去难过的要死 ,3
23803,其实胸背手臂很多动作也可以练吧 ,6
23804,医生要我静养要等症状完全没了才能再慢慢恢复运动，我真的急也急死了，本来练的都有点成效了 ,3
23805,还以为你不喜欢吃杭州菜呢！ ,6
23806,我那么喜欢喜欢杭州喜欢你 ,2
23807,杭州菜这么甜，合你口味吗？ ,6
23808,中兴要是肯听别人的至于走到今天这一步？ ,5
23809,中兴老总不如你成功 ,5
23810,中兴老总我不知道，但你不如我成功 ,5
23811,找工作不要太着急积累经验很重要更不要眼高手低也许不中听但是是事实愿你早点找到喜欢的工作加油 ,2
23812,这道理我懂，毕竟我不是刚毕业的 ,6
23813,这么说你也一把年纪了 ,6
23814,我的7更新系统后超卡，卡到让我以为苹果变成了三星，好几个游戏都卡的不成了 ,5
23815,入而且掉电是火箭般的速度，而且指纹解锁基本不灵 ,5
23816,对对对！指纹解锁就是在更新后出问题了，能打开的可能性百分之二三十，几乎只能用密码 ,5
23817,内蒙古协同共享经济新模式加减法龙哥怎么看 ,6
23818,我写加减法的智慧，论的简政放权，优化服务和另一个，还偏了点经济，哎，真是烦 ,3
23819,我政治经济文化放管结合齐上阵要不那么多文化的材料没用害怕 ,6
23820,哇。一个人吃那么多。好胃口。 ,2
23821,你的手臂不是么别装了 ,6
23822,这手臂又没写我名字。你说是就是啊。 ,6
23823,哼无聊你的鞋也入镜了！小粗腿儿〜 ,6
23824,不要进行人身攻击腿粗是我的错嘛  撮中我内心最柔软的地方了双眼含泪了 ,3
23825,进步好多诶~！光影很美 ,2
23826,表情动作还是有点单一，继续努力。能得到你的夸奖，我很开心啦 ,1
23827,一起加油~光影运用很重要的~ ,2
23828,不是装作，是真的很酷，毕业快乐呐 ,2
23829,很伤感啊   学姐 ,3
23830,时间过得真快，转眼你们都要毕业了，未来会更好的 ,2
23831,很有爱很感动 ,2
23832,如果你一起来就好了 ,6
23833,希望你毕业的时候叫我去我一定到场 ,6
23834,一定啊！！你不来我不跟你讲话了这世人 ,6
23835,哇哦原来国花等还是运动健儿？ ,6
23836,省测不幸的抽到了我们班 ,6
23837,偶买噶这运气666哈哈哈是时候展现自己了 ,1
23838,会带回家，给我做饭洗衣服 ,6
23839,太残暴了！！哈哈哈 ,1
23840,北京租房这么贵，肯带你回家很不错了好嘛 ,6
23841,哈哈哈，我要说我在望京有房你不是会很失落？ ,1
23842,我喜欢今生是第一次的秀智！！！！ ,2
23843,挺酷的，遇到一帮垃圾同事是真倒霉 ,5
23844,我太喜欢她了超级酷我还喜欢普美列个公司女职员这个剧就充她去看的 ,2
23845,我不是人啊你不是人啊 ,6
23846,我是人你不是人 ,6
23847,原来你不是人我是人   原来是这样的~ ,6
23848,即将毕业的大四学生。对未来可期，有喜欢的姑娘。 ,2
23849,即将毕业的大四学生，没有喜欢的姑娘 ,6
23850,还很早，现在没有未必不好。 ,6
23851,哈哈哈哈哈哈哈现在没有其实很好 ,1
23852,你不要这么消极！！！ ,6
23853,我感到不好，可能过一阵就好了 ,3
23854,别被负面情绪打败！！ ,6
23855,张晟老师的课吧 ,6
23856,是的已经无数次中枪下次要好好听课了 ,6
23857,哈哈，我也是经常被她提问，无论坐在教室的哪个角落 ,1
23858,宝宝画口红了吗 ,6
23859,怎么可能嘛他小嘴就那么红 ,6
23860,小嘴看着红的呀！这个配色确实暖 ,2
23861,温州还有很多有名的宵夜，我特喜欢人民路天上人间后面的猪脏粉，以前夜宵都那边吃的 ,2
23862,那家我也去吃过，是荷花那里搬迁来的对吧？ ,6
23863,好像是他们家吃的人很多 ,6
23864,对呀！还没休息呀？ ,6
23865,有三样吃过！ ,6
23866,哟，那看来不错嘛，下次请你吃剩下的 ,2
23867,说个时间喂！这周末我给老大拿电话啊！ ,6
23868,他们需要你原谅吗 ,5
23869,我的喜好我的三观需要你来bb吗？ ,5
23870,那别人的人生需要你来bb？需要你来原谅？ ,5
23871,你打算以后自己布置自己的婚礼吗~ ,6
23872,对啊无形中又给婚礼省了一笔钱 ,6
23873,是不是婚礼上的所有花艺你都可以啊？ ,6
23874,我这还比较初级不过一般的应该没问题要不要雇我啊哈哈哈 ,1
23875,哈哈，我没到那时候呢，不过真想找你啊！ ,1
23876,怎么讲都去逛街了吗 ,6
23877,说去漂流堵了六个小时还没到目的地吃了个农家乐速度回城途中车停在山上还被哪个龟儿子擦脱了漆 ,6
23878,听起来就是刺激的一天 ,6
23879,更刺激的是12点回成都大家觉得不够尽兴一波人去了ktv嗨到了四点喝了三件歪啤酒今天男票要死不活的 ,6
23880,还有这种事？人没事就对哈。看来国外也不咋滴。 ,5
23881,那边治安不太好'我就奇怪了'大白天的没人守车么？ ,5
23882,国外也有那么多穷凶极恶的人啊 ,5
23883,我喜欢他家老高跟鞋！超级好看…我买的黑色的…新高跟 ,2
23884,小王子那个也好好看啊 ,2
23885,美丽的红棕色！确实很不错做手帐必备啊… ,2
23886,哈哈哈哈哈阿帕奇的晚霞也超级好看还有祖母绿 ,1
23887,我到家了可以回了 ,6
23888,刚吃上，九点半左右回去！你不要出门哦！ ,6
23889,我带回就走哈哈好 ,1
23890,你真有福气伐，老有大攴吃!羡慕羡慕! ,2
23891,汗〜暴饮暴食其实很不好嗒〜要健康饮食〜你现在的生活状态才好呢 ,2
23892,呵呵，我现在休整期，快发霉了! ,3
23893,ht什么时候出新的李小龙啊！出点乔丹什么的也行啊，tmd我喜欢的角色和类型都被eb糟蹋了。 ,5
23894,乔丹十二月份！新的李小龙也就那么回事儿，面部依然处理的让人失望。还是ht吧兄弟！ ,5
23895,我希望ht出李小龙和nba啊~可是不知道李小龙的版权永远在eb那里了 ,5
23896,昨天说的更新碎片商店，到现在都没动静 ,6
23897,这期没说要更新碎片商店吧，是两个夺宝更新了 ,6
23898,昨天官博回复了评论说，一会儿更新碎片商店 ,6
23899,然后呢，看上哪位了。 ,6
23900,面目比较和蔼的女性基本都是我的目标客户。 ,6
23901,客户经理真好，到处和人套近乎。 ,2
23902,哪里好，每天讨好别人，还被一堆人负责，我现在跟卖保险的没什么区别。 ,3
23903,已截图，并举报，实名制造谣要付法律责任！ ,5
23904,随你举报，又不是造谣 ,5
23905,拿出数据，空口无凭不是造谣么？？！ ,5
23906,你还要去见这么帅的哥哥呢 ,2
23907,啊啊啊我光看图就要昏厥了！！我怕真的看到我就要窒息了 ,2
23908,哈哈哈哈羡慕求哥哥给我机会见见 ,1
23909,超级好看啊！！！第二次拍都这么好！！ ,2
23910,主要是姑娘长得好看 ,2
23911,姑娘长得也是真好看～你拍的也是真好～哈哈 ,1
23912,大哥，你确定你配的图是对的？？？ ,5
23913,前四个肯定是对的呀，你没看那还有台词，后面那个充数的 ,6
23914,竟然凑数！差评！ ,5
23915,帅哥都搞基去了，这让姐妹们怎么活 ,3
23916,搞基好歹也带我看上一眼啊，关键是木有 ,3
23917,青阳街倒是有，我以前的男闺蜜，哈哈，不过人个出远门了。 ,1
23918,为啥你就能弄成空气刘海 ,6
23919,我就随便一剪，一个挫爆了的胖男人剪的哈哈哈哈忘记了他娘泡的英文名叫啥了 ,1
23920,我找韩国人剪的她帮我弄完回家洗完头我就不知道咋整了以后还是去桥下找5块钱的剪头大叔吧 ,6
23921,你不是一般的可爱 ,2
23922,baby，我星期二休息，来看你好不？ ,6
23923,嗯嗯，好好，约起菁妹哈！ ,2
23924,这么便宜的火车票！ ,6
23925,恩～上海还有到金山的城际火车也这么便宜还能刷卡呢 ,6
23926,好像我也坐过这么便宜的湘潭到长沙的 ,6
23927,那你叫我们   认空姐 ,6
23928,估计你认得比我全呢！ ,6
23929,那不一定  嫦娥，你还欠我桃子妹妹呢 ,6
23930,我找不到那本挂历了怎么办？ ,6
23931,好吧  ，先欠着，等你拍真人，。 ,6
23932,我很难碰到桃子妹妹哎，我们不是一个候机楼的我都没有亲眼看见过！ ,3
23933,好吧，那汉莎大妈和你们一个候机楼嘛？ ,6
23934,原来我的高中同学真的有报公务员的啊~话说你报哪了？ ,6
23935,我报南宁的啊，不过国考是报来玩的，我是想试试明年的区考 ,6
23936,你应该不会跟我报重吧？我报的高新区~怎么大家都爱考省考，难道省考比较容易还比较有钱途？ ,6
23937,我害怕又resou ,4
23938,不会吧这没啥好热搜的我感觉没有啥点 ,6
23939,前几次都上了渣浪的心思你别猜 ,6
23940,好久不见，新年快乐，终于看到你发照片，来台湾玩呀 ,2
23941,新年快乐，哈哈去台湾参加一个展览，已经回大陆了 ,2
23942,有空常来玩。还是好喜欢你的iphone随手拍。该开放线上授课的，想学 ,2
23943,怎么断的啊，真是佩服你，孩子带那么好 ,2
23944,呵呵谢谢夸奖！等生了孩子，自然就会带了，这是本能！ ,2
23945,还有2个月生，焦虑啊 ,4
23946,你的毛笔字还是一如既往 ,2
23947,什么一如既往，我以前没发过毛笔字啊！不是夸就不要说了 ,6
23948,画好看你画的什么我都喜欢 ,2
23949,我也不开心   可是还得坚持加油吧吃点好吃的我又胖了 ,3
23950,最近钱包太紧张唉，坚持不下去了，快顶不住了宝宝你为森么不开心，今天你应该过节呀 ,3
23951,哈哈哈哈哈我过节。还没男人和我说个节日快乐的呢。巧克力都是我自己买的哈哈哈哈 ,1
23952,哈哈哈，挺好挺好，祝你节日快乐 ,1
23953,做你的同事多幸福啊 ,2
23954,哈哈，不是啦，是因为今天很多人去考试，其他科缺人上班，所以我们要去支援我看到芬妹你也报名了，考得如何？ ,1
23955,哈哈，头一次报，是被逼的，当然是考砸了。 ,1
23956,也是昨天第一次听，才发现《红豆》还有粤语版。 ,2
23957,私心里把它当成独家收藏词太棒了 ,2
23958,不知道为什么，如果一首歌有两版的话，总会偏向粤语那一版多些。 ,2
23959,对的，就比如国语版的《约定》，太腻了。第一次听到粤语版，惊艳得昏特过去了 ,2
23960,肉必须首先被消灭掉！ ,6
23961,对！先把好吃的吃掉，才能在如狼似虎的同学面前抢到他们肉吃（他们抢不到我的就很棒 ,6
23962,你比我优秀我从来抢不到她们的肉 ,2
23963,啊啊啊啊啊啊啊我也是喜欢鹿晗也喜欢张韶涵 ,2
23964,快乐追星双倍体验✌️ ,1
23965,没毛病，今天看的路透我都惊呆了，有生之年啊，我的两个憨憨 ,2
23966,你好请问怎样才能知道自己考试预约成功了呢？ ,6
23967,你约考完看到一个叫你打印的页面就可以了 ,6
23968,我好像看到了，但是我直接退出那个页面了，也不知道咋办，我不知道自己的确认号码•﹏• ,4
23969,以后红红可以在西伯利亚女王面前趾高气昂的显摆我赢了三次你猜她第二天会不会被麻子扫 ,6
23970,她最近打麻子不是连败吗 ,6
23971,两连败吧年终给扫了法网三盘 ,6
23972,不是突发性厌世，是一直都挺厌世的，活着太痛苦了，精神折磨很痛苦 ,3
23973,不要这样朋友，生活还是有乐趣的 ,2
23974,干嘛，我又没有说要自杀，可事实就是这样，不是一时兴起的感受，是多年的切身体会 ,3
23975,起床啦太阳晒屁股啦～～～ ,6
23976,我就睡了两个小时你发烧怎么样了 ,6
23977,好很多。不过那个药死难喝死难喝的，我都想吐。 ,5
23978,我的还不是难喝我在上课好烦 ,5
23979,北京大外的顺下辽宁就解决不了，可惜广厦的大外不会啊 ,3
23980,一针见血，而且广厦没人会中投，所以韩德君老虎不出洞，就算会下顺，也没卵用。 ,5
23981,广厦大外脚步也没比韩德君快，尽管他会投三分，韩德君只要站到他面前就可以，一点不累 ,5
23982,最后那个三分也是运气不错，弹了好几下进去的。不过输球也不是坏事 ,2
23983,是的，我觉得是好事。今年骑士季后赛太顺了。要经得起挫折，偶尔的失败是最佳的磨砺方式。 ,2
23984,就我两个詹密在这水，勇士要喷了 ,6
23985,水果能借一个充充饥不？顺便能不能解释一下为什么就这么这么的居家也。 ,6
23986,随便吃哈不要客气表问为啥居家这是个异次元现象 ,6
23987,异次元，好嘛，带点果子，时间里旅行 ,6
23988,嘿嘿，累得倒头就睡着了 ,1
23989,哈哈，我知道啦。德国回来了？ ,1
23990,还没呢。不过国内快放暑假了。假期要不要带小弟弟去哪里玩。他都长这么大了 ,6
23991,回来后过来玩。假期还没计划。 ,6
23992,借楼问问有没有什么办能法拔高个十几厘米 ,6
23993,没有你找不到媳妇了 ,6
23994,那我祝你越来越有分量 ,6
23995,也祝你越来越是精华 ,6
23996,而且感觉很像那本我不喜欢这世界我只喜欢你 ,5
23997,您老不知道先出的是满满都是我的爱吗？我个人还觉得满满写得好些呢？不能睁眼黑⊙▽⊙ ,5
23998,我有说她抄了吗？  睁眼黑？我还真不知道 ,5
23999,现在大厂都圈钱，独立创意游戏才是真玩家的归属。 ,6
24000,我几乎没有喜欢的大作 ,6
24001,喜欢便好，哪分大小。 ,6
24002,玩的比较边缘跟主流玩家比较没有共同语言 ,6
24003,并不觉得雷曼、地狱边境这种边缘。另，你说的主流玩家的玩得是哪些？ ,6
24004,窦骁我好喜欢你！加油！狼图腾一定去看！ ,2
24005,头像好好，是他们什么剧照嘛？ ,2
24006,好像是《在一起》？不好意思呀不太记得了 ,6
24007,别换了，现在这个更符合你气质 ,6
24008,喵喵喵？豆芽有这么可爱的气质？ ,6
24009,没有气质就是最可爱的气质 ,2
24010,到现在还没吃饭学校饭菜跟猪食一样活生生的诱惑 ,5
24011,等你出了学校你就知道有多怀念学校的饭菜 ,5
24012,是真的不好吃！一般学校的我是不会说不好吃的 ,5
24013,哈哈哈不知看到蓝那段还是恩桐那段 ,1
24014,蓝嘉文！看的我太生气了 ,5
24015,小三的嘴脸太难看 ,5
24016,我同意啊五个人的聊天群没人聊天了怎么可能让人不怀疑会多了一个四人聊天群 ,5
24017,是啊，他们几个互相点赞朋友圈，却从没和我互动过呢，也许就不是一路人吧 ,5
24018,啊真的是感同身受了啊「你去主动找可能他们还在群里嘲你主动倒贴」 ,5
24019,我要来抓海子！！！！ ,6
24020,帮我抓一只母的！！这个时节喜欢母蟹 ,2
24021,我真的能抓到？ ,6
24022,听你这么说，我都想怀孕了！ ,6
24023,呵呵，这水平估计一时半会你还没法具备啊。 ,6
24024,还真不会这项技能！ ,6
24025,这是谁啊？眼睛没问题吧！ ,5
24026,你是认为这人眼睛瞎了是吗 ,5
24027,没瞎，就是有问题 ,5
24028,哈哈哈哈现在流行360度全方位服务 ,1
24029,你要是和我买车你也能享受到这样的服务哦！ ,6
24030,那太遗憾了，没钱买车没恋可失 ,3
24031,哎，这活着～累！ ,3
24032,合肥的采蝶轩和中山的采蝶轩是一家公司不？ ,6
24033,这我就放心了，我在中山的买了月饼 ,6
24034,没事，暂时没听过有什么问题。 ,6
24035,嗯嗯嗯。中山这边的卫生看起来挺好的，晚上晚一点都没有了 ,2
24036,大妹子私企没有公休假，他可能是国有企业或者公务员，最差是擦边的外企 ,6
24037,外企更有公休假的，俺就是外资的 ,6
24038,注意，擦边，擦边，徐州大多都是擦边的外企 ,6
24039,就是后面太伤感，小小年纪都能感到的悲凉 ,3
24040,当时很多东西没看懂，就看见陈坤帅了 ,2
24041,他那种清冷忧郁的气质真的是挺迷人，不是光光外形，几个兄弟姐妹的故事都蛮典型 ,2
24042,我觉得现在监管越来越差了！ ,5
24043,从古至今毒品就和蟑螂一样顽强的存在在地球上 ,5
24044,哎！主要现在法律越来越任性了！抗战时代早枪决了 ,5
24045,刑法修正案九，都废除了9个死刑犯，刑法修正案八取消了13个经济性非暴力死刑。中国未来的趋势是限制死刑。 ,5
24046,你居然真的回来了！那你把你妈妈一个人扔下了啊。去重庆吗 ,6
24047,对啊，我们现在已经到重庆啦，我们一起回来的呀，我妈高反比我更严重 ,6
24048,我现在到高原了在2000多米了 ,6
24049,好喜欢这组！！！ ,2
24050,出去考察路上拍的。没有后期。用的相机里自带的一些小东西。感觉路上会有很多好看的风景。 ,2
24051,没有后期的色调都好协调 ,2
24052,我对我没有哥这事念叨了好些年 ,6
24053,除了羡慕还能怎么办呢 ,2
24054,虽然没哥，但有个弟才十岁！有什么用呢！！就hin羡慕了 ,2
24055,呵，女人，你还欠我一个么么哒 ,6
24056,就想着占我便宜 ,6
24057,呵，我们都是同过床的关系了你在害怕什么 ,4
24058,支持骑单车的朋友，有需要可以联系我。我可以给你提供住宿。洗个热水澡 ,6
24059,谢谢，已经到麻阳了，去西域地区 ,1
24060,我喜欢一个人骑车到处跑。呵呵希望能够提供一些力所能及的帮助。 ,2
24061,原来是穆老师不是木老师 ,6
24062,你怎么知道穆老师的 ,6
24063,我去宁波找你的那几天你跟我讲你工作的故事，提到了好几次 ,6
24064,表示认识一个叫做佳宜的不算漂亮但是很好玩哈哈 ,1
24065,我们高三班里就有一个很漂亮的哈哈~然后昨天晚上看完了《那些年》，里面的沈佳宜也是超漂亮！ ,1
24066,校园网速度太慢了，想下载都怕 ,4
24067,有了宝宝要开心，一天一个变化多可人疼啊。现在宝宝几斤了 ,1
24068,谢谢太小又早产没去称。知道应该高兴，可是控制不住自己 ,1
24069,比你不幸的很多，别对生活失望。看着宝宝，他是你的动力你的全部。 ,2
24070,俊谕哥晚上好！！吃饭了嘛？！！我今天遇到小偷了！！！ ,6
24071,不会吧？东西没少吧？ ,6
24072,手机差点被偷！还被吓了一下！！！ ,4
24073,没有被偷就好，下次多个心眼快过年小偷多呢 ,6
24074,小p孩这么吃香啊 ,6
24075,我被吓到了！脸跟猴子屁股一样 ,4
24076,他儿子在你们那住院啊？长的帅否啦？ ,6
24077,他还把他老婆带到办公室来看我，然后说啊说的，害的我好囧 ,5
24078,这也太明目张胆了呀，完全不考虑你的感受，太以自我为中心了，这种人，我们要一起bs ,5
24079,你敢放点儿清楚的照片吗 ,6
24080,网络不好怪我喽 ,3
24081,我大双眼皮儿彻底晒没了 ,3
24082,这是五阿哥给他的阿哥府邸妃子发的福利！羡慕嫉妒恨。五阿哥爱妃子，不疼老妹。 ,2
24083,谁让你不当妃子还是个天天爬墙的调皮妹妹我这谁的黑底都有 ,6
24084,小妹好，妃子太多，我怕打起来。这个表情好可爱。 ,2
24085,我一直都相信有坏人肯定有好人，这是辩证法 ,2
24086,您永远不失对生活的信心感人 ,2
24087,热爱生命，认真的活着，甚至也可以无知无觉的活着，我认为除此之外别无他法。 ,2
24088,一看就是很少仰望天空 ,6
24089,太阳这么大，平时眼睛都不想睁开，怎么仰望天空呢 ,6
24090,可是美景只在天上有，你需要仰望天空 ,6
24091,那可不一定  只要愿意找，人间处处是美景 ,2
24092,我也喜欢榛果拿铁喜欢红杯杯 ,2
24093,我觉得每年圣诞的马克杯都很好看 ,2
24094,我喜欢他们和thermos合作的冬天喝过了好久还是暖暖的 ,2
24095,可是贵呀！不如直接去买膳魔师的 ,6
24096,哈尼你怎么跟我一样迟钝，我感觉到了地震可我以为是自己太沉压了一下椅子 ,6
24097,哈哈哈哈哈哈哈你很棒棒哦，要奖励你小红花 ,1
24098,某个少女沉迷网络连地震都布吉岛 ,6
24099,老板就是她！！到处乱送奶茶让你亏本！！ ,6
24100,我看美女我才送的 ,6
24101,你说的好有道理我竟无言以对！ ,2
24102,我总能准确的抓到你的命门 ,6
24103,三年你能坚守底线不错 ,6
24104,不一边打扫一边爆粗口想爆炸 ,5
24105,但是能坚持打扫卫生从侧面也反应了你的优点啊 ,2
24106,有水泥路的话，建议卡罗拉双擎。保养也不贵，又省油，混动是大趋势 ,2
24107,对啊，买个汽油的估计也用不了太多年。 ,6
24108,嗯，目前各个国家已经出台了禁售燃油车的政策了，中国也不会远了 ,6
24109,土豪我们来交朋友吧！ ,6
24110,郭副帅谦虚了吧~ ,6
24111,别闹了~土豪我们也一起粗去玩儿吧 ,6
24112,终于成功了！！！ ,2
24113,出乎意料，而且还不难受 ,6
24114,不错不错，以后想戴都可以了 ,2
24115,今年还去法国旅拍吗，还是那个活动 ,6
24116,嗯，哈哈马上又要出门了 ,1
24117,还是和你那个买一送一的弟弟去嘛 ,6
24118,啊哈你是不是最近会算命了？ ,6
24119,好棒友友、最近我少上博，天冷保重哦！ ,2
24120,谢谢紫云，今日阳光灿烂，有蓝天白云，暖和多了。 ,1
24121,昨天深夜忽然下雨，凌晨深感寒意，这会露脸了！ ,6
24122,亲，你的回复我几时能看到 ,6
24123,哈哈，我刚看到，我说你咋没反应 ,1
24124,可以理解，脑残，要不是我那么关心你呢 ,5
24125,你竟然才看！！！ ,6
24126,不是啊，之前就看了，但是每每回忆起来，都觉得甜的不行啊 ,2
24127,台剧经典还有一个我也很喜欢我可能不会爱你 ,2
24128,那是相当富有啊 ,6
24129,呵呵，我才发现早都关注了你，可惜你还没有关注我哦 ,6
24130,我有关注你啊 ,6
24131,我的小天使也胜利了 ,2
24132,哈哈你是什么事情产生了矛盾 ,1
24133,想念与无法联系哈哈 ,1
24134,苏可我没尝过你的手艺 ,6
24135,如果去年的饺子不算的话，那好像是真没有 ,6
24136,有机会一起约起来煮饭 ,6
24137,我家楼顶昨天也砸下来一大块！老大声了！一大片阴影！当时还以为有人跳楼了呢！ ,4
24138,你这更可怕！！！这天你就别出门了，安全最重要 ,4
24139,嗯。憋死我了！我都五天没出过门了。 ,3
24140,今天刚吃了拉面早知道给你拍了 ,6
24141,最近感觉我们真是超级心有灵犀 ,6
24142,你怎么会这么想 ,6
24143,听了可以和我私信聊聊 ,6
24144,我早都想和你说了怕打扰你休息呀走私信走起 ,6
24145,别。你全部结束之后再总结告诉我一下，我就听听。因为我现在身体，绝对没办法过去了呀 ,6
24146,亲，我做全麦面包的时候核桃放多了就会很难发起来的，我看你的发的很好啊！不知怎么回事？ ,6
24147,核桃切小块了吗？我这核桃量确实不少  发酵没觉得受影响呢 ,6
24148,切小了啊！难道是酵母？你用的是什么牌子的？我的是燕子的，谢谢哦！ ,6
24149,我用的就是普通的安琪酵母你做别的面包用燕子的正常吗 ,6
24150,另外的发的起来，对哦，那就是另外原因了，近段时间总是做不好面包，麻烦啦 ,6
24151,我曾经的恶梦呵呵 ,4
24152,难道说你没通过？ ,6
24153,6年前考了三次哈哈 ,1
24154,白玉堂被毁了我是坚决不看的 ,5
24155,哈哈哈哈哈哈，其实挺乐的。互动挺有爱的 ,1
24156,接受不了我的白白不是这样的 ,5
24157,真好看，这么久以来最好看的一张！ ,2
24158,哈哈看来你喜欢学生党 ,1
24159,我喜欢长着大叔脸却貌似学生党一样天真无邪的样子！ ,2
24160,不是又是那个xx吧？ ,5
24161,估计你说对了，就是咱俩之前说的那个 ,5
24162,她又对你做什么了？？ ,5
24163,真的是越来越好看了！ ,2
24164,听到鼓励的话真是太好啦（手滑要点回复竟然点了两遍赞hhh ,2
