,text,label
0,我就奇怪了  为啥你能拍得这么美呢 ,2
1,因为我做什么都认真，都诚心诚意！ ,2
2,好你诚心诚意！我谦虚低调！咱都是优秀品格的人再赞一个  干杯 ,2
3,是这是人家自己的事就算我能见到她也不会说你们分手吧什么的可是我真心不喜欢冯绍峰这个理由够吗 ,5
4,最起码那孩子对倪妮没恶意，你不开心也别来这里找人吵架不好吗 ,5
5,我只是看到评论觉得很不爽而且憋很久不懂的可以闭嘴吗 ,5
6,狂上加狂的旧时燕飞帝王家和危宫惊梦 ,6
7,哈哈，我也推这本。她古文好厉害 ,2
8,原来特别喜欢他写的耽美，没想到男女的也写的很好看，太棒了哈 ,2
9,呵呵呵呵呵呵呵呵你拍我家枇杷树跟我说了嘛！！！不准吃我家枇杷！！！都我的！！！ ,5
10,写你名了？写你名了？写你名了？ ,5
11,你难道没看到么，当初我在每颗果子上都刻了我的大名！！ ,5
12,哎，我就吃下这个哑巴亏算了 ,3
13,呔，妖怪，死到临头还嘴硬 ,5
14,真不愧是嘴脸红，看我不收了你 ,5
15,自古真情留不住，唯有套路留人心 ,3
16,"偶看报纸上的评论,好像也不看好. ",3
17,明天要是有时候间就去看少年派据说很好，周末快乐哦 ,2
18,周末快乐!等你看完再讲评讲评哦 ,2
19,你这个包裹厉害的！据说最近除重量外，要算体积了。 ,2
20,我刚好是在那个通知发出的前一天发货的 ,6
21,太棒了！我的几件东西还没到齐，还得等几天 ,2
22,你也买啦我买了16家，都是很快就到了 ,6
23,道理是这样的，不过茶没味了，也是有过程的。有些茶是会让人回味无穷的 ,6
24,茶本身不会回味无穷，能够回味无穷的都是自己内心的感受。 ,6
25,其实只要经历过就好，忘记的就忘记吧，明天会有更好的回忆。圣诞快乐 ,2
26,我当时也是这样想的～实在是太美了～ ,2
27,是咯，不过我还是好想换相机喔哈哈 ,1
28,要换单反么？？不过我最近才刚买了新的 ,6
29,亲爱的你买的啥？ ,6
30,样子问题！我早就说了不卖！哈哈 ,1
31,要你管啦，票房又不能说明一切，不过有些人不懂欣赏罢了。 ,5
32,啊哈哈，叔叔莫着急，你喜欢周杰伦必须得爱屋及乌的啦！ ,2
33,这还差不多。诶你大学录了吧？ ,6
34,现在才知道来关心我！ ,3
35,饿，我这边好塞车。 ,3
36,你唔系搭地铁嘅咩？ ,6
37,地铁？要专线，好远。 ,3
38,这什么地方这么落后啊… ,3
39,居然是广州的一个铺位 ,3
40,你没给他普及微信支付么…看来还要加大力度啊，看来这老板平时不玩微信啊！ ,3
41,pgone陌陌号上发dp照片配字：约吗 ,5
42,还在626国际禁毒日那天发的…屁股王很牛逼是吗？ ,5
43,对呀光明正大抄袭又光明正大约d王昊怕过谁 ,5
44,拒绝就不会吃了 ,6
45,你这逻辑有问题，好好读书吧 ,5
46,呵呵哒，难道你是来这里展现自己的高风亮节的？ ,5
47,你们为什么见到雪那么兴奋 ,6
48,我从小到大没有见过雪。你觉得呢。跟你们喜欢大海一样 ,1
49,我本人对大海没什么感觉hhhh第一次看见也不兴奋 ,6
50,所以在盼望结束么 ,6
51,是期待奖品的那天嘻嘻 ,1
52,那要是抽不到你你不得哭 ,6
53,最好吃的是什么？不是季节啊，我首先想到的就是大闸蟹。 ,6
54,那边没有最好吃的！不好吃都 ,3
55,坐高铁去得？几个小时多钱？我考虑要是去上海可以考虑坐高铁去武汉吃米粉哈哈 ,1
56,尼玛你直接飞来我请你吃够！哈哈 ,1
57,我想知道有没有好心人点进我的相册看看我是几分的…（小声逼逼&瑟瑟发抖） ,4
58,8分呀6条条条符合呀 ,2
59,真爱宝宝怎么在这被你捞出来的 ,2
60,摸摸头，坚强的小土豆！ ,2
61,噗你也是大家都一样作为特别关注我特别荣幸噗 ,1
62,哈哈哈，我还指望着你成了网红一起卖面膜呢 ,1
63,铁定是没成功啊 ,3
64,哎呀〜你觉得可能吗！我一出马不成功不可能！ ,2
65,哦哟，是不是哦，出马和看看 ,5
66,哈哈哈哈！开玩笑的！人家一定要谦虚啦！ ,1
67,可我觉得他没有比赛的时候可爱了样子变了 ,2
68,是的的台下很可爱脸怎么尖尖的了不过唱歌的时候真的好腻害 ,2
69,嗯嗯唱歌超好听手都很帅 ,2
70,不太懂素锦为啥对着镜子说话，她不知道她手上的镜子是夜华的而另一个镜子在素素那么 ,6
71,就是故意说给素素听 ,6
72,她说的那个话特别真诚我以为她想对夜华说 ,6
73,播音界泰斗齐越老先生 ,6
74,对对对，文化人呀 ,2
75,我是播音主持专业的哈哈 ,1
76,照顾好自己！抱抱 ,2
77,抱抱也不知道最近怎么了身体这么差 ,3
78,我男朋友上个月也是超级背还一直生病水逆嘛！！都会好的！ ,2
79,为自己准备好纸巾了不哭不是我本人 ,3
80,我到时候都不想投票了双重压力 ,4
81,我姐妹跟我说:“说不定你哥哥就差你那几百票”痛苦啊 ,3
82,这个时候无比希望公司下场帮我们投几个小时票好不好 ,3
83,我们根本指望不了公司555他们只想简单快乐 ,3
84,我不喜欢秃子！ ,5
85,秃子怎么啦？怎么啦？怎么啦？环保节能又可以照亮。 ,5
86,秃子有点像吸毒的啊！ ,5
87,可以找你谈恋爱不周末包接送的那种哈哈 ,1
88,不和hmp谈恋爱那种又是哪种 ,5
89,乱说你误解我了我只是幽默一哈 ,1
90,可能是嘛这样子幽默我就只有呵呵了 ,5
91,十个高地9个基（外加名字可以确认也是基！ ,6
92,哈哈哈哈哈哈哈哈哈哈哈哈哈哈哈哈哈哈哈哈哈哈哈哈哈哈我是基佬我骄傲！！！（名字一点也不鸡！） ,1
93,天宝伏妖录还不基！ ,6
94,我只注意到了是“他” ,6
95,哈哈，是男生，然而好朋友没有性别之分～ ,1
96,我不管，又一个潜在情敌 ,4
97,你啊你啊!!真系好靓啊你!! ,2
98,好似你靓d喔~ ,2
99,你有星味~哈哈!! ,2
100,小学你就38的脚了！莫非阁下就是江湖上人人敬仰的赤脚大仙？小弟乃诚实可靠小郎君，人世间一迷途小书童，久仰大名 ,6
101,你是第二个发现的脑子一下子没转过弯来 ,6
102,泡脚好事情，解乏，还可以去死皮，小时候你就知道这些，长大不得了的 ,6
103,好家伙  被你一说  我感觉自己突然好机智 ,2
104,哈哈··看你美得···多练练··省的下回再扭到·哈哈·· ,1
105,不是扭到  是脚一直抽筋不知道怎么回事唉 ,3
106,带着耳机影响你发挥了··赶紧整个小音箱去··· ,6
107,呵呵我也正有这打算呢  没有音箱太不方便了  明天得空了去淘个 ,6
108,衣服真多，可以换两小时 ,2
109,数学上有排列组合这一说，两条裤子三件褂子可以搭六套，以此类推。 ,6
110,真羡慕数学学的好且衣服又多的人 ,2
111,政府同意，人民反对，请问这是什么政府，还有是国家哪部法律，第几条 ,5
112,这个破安检一看就是地方zf一意孤行，为了向central谄媚、交差话说，层主也玩舰r ,5
113,对的，要来波好友么 ,6
114,十八线假装是莲花的绿茶，38线的喷子 ,5
115,毕竟十八线，人家也急呀不上杆子蹭点儿也没辙 ,5
116,你美，你说的都对 ,2
117,到哪儿热评都是她各种扎眼 ,5
118,你的高光用的什么牌子的啊？灵不灵？ ,6
119,用的棒啊！估计你会觉得油腻腻，我蛮喜欢的。不过男生会说满脸油光 ,2
120,什么牌子的啊？看起来不错呢，我也一直想买高光的 ,6
121,你永远走在我前面，注定要给我提供攻略！ ,6
122,好的据说九月贷款比较紧  我正好可以请个假嘿嘿 ,1
123,意思是我也能休息休息了？ ,6
124,没错哈哈等我给你提供攻略 ,1
125,好的，你们云南跟团么 ,6
126,下次找一张我侄女的照片发给你看，和你家闺女长得一个样。现在大学教书。 ,6
127,也有这么肥大？ ,5
128,长得像，胖得也像。 ,6
129,如果女的回答，看过画的，怎么办？然后女的继续补刀，她认真想五角星她看没看过怎么办 ,6
130,撞上了，我的回答就是看到过 ,6
131,很好很好很好 ,2
132,你好厉害~我好怕怕~万一碰见你！你会不会骂我啊 ,4
133,怎么可能？一看你也不是那么没素质的人。另外我现在也不跟那种人较劲，犯不着。 ,6
134,我很乖的~开车特别文明~我准备明天给后面弄个'新手上路' ,1
135,你也不吃葱吗 ,6
136,此物乃世间不合理存在之一 ,5
137,可是有些食物没有葱又觉得少点什么挑葱好辛苦 ,5
138,生日快乐，去年我们一起，今年大家都在不同领域努力，加油！ ,1
139,好怀念在剧组的日子…蛇蛇都拍好几部戏了，火了可千万不要忘记飘姐 ,6
140,哈哈，飘姐现在了都是主持人了呢希望有天你主持节目，嘉宾是我，哈哈哈 ,1
141,真小资去加拿大的准备工作一切还顺利吧？ ,6
142,还没啊，昨天刚刚发邮件给加拿大大使馆催签证，好怕这两周h出不了啊 ,4
143,我当时也是，签证在航班前一周才粗来，加政府效率一塌糊涂的~ ,5
144,阿佳妮！只看过她一部《地下铁》，就爱得很 ,2
145,玛戈皇后里的阿佳妮美不胜收，活生生大仲马笔下走出来的 ,2
146,刚搜了下，没找到源 ,6
147,有个手工客的app，做布艺、木工之类的，很好的 ,2
148,恩恩，我已经下载啦~感谢推荐 ,2
149,我也下载打算做木工呢 ,6
150,热的就是宝藏啊 ,2
151,是哒！我喝的很慢所以我一直买小杯我妈今天给我买了大杯我没喝完就冷了… ,2
152,哈哈哈哈其实我也是只是想喝但是买了又喝不完 ,1
153,台风就快过去了的说 ,6
154,难道台风过了就会热？？？ ,6
155,应该会，往年冬天还能穿短袖的 ,6
156,那是变态天气变化的时候⊙﹏⊙ ,5
157,无问东西我觉得也不错啊你们二位喜欢不 ,2
158,无问西东去掉渣特效之外还凑合，但是没有那种深入人心的东西 ,3
159,为什么每个人感受真不一样 ,6
160,喝点生姜红糖水，热热的喝，我也感冒了 ,6
161,嗯，吃了药，准备再泡泡脚。头疼得不行。你多注意啊! ,6
162,准备等会喝生姜红糖水 ,6
163,早点睡，感冒要多睡，好得快。 ,6
164,嗯，你也早点好 ,2
165,你的美瞳哪里买的？ ,6
166,我不带美瞳的，感觉不舒服 ,5
167,你知不知道哪里有好点的美瞳卖？ ,6
168,一加出自oppo系，抄mback，不要脸 ,5
169,还有魅族申请的专利不是home键而是mabck，home键的交互方式。你这么能喷怎么不去喷zuk啊。傻子。 ,5
170,抄别人的东西还不知羞耻，oppo也就这b样 ,5
171,我们也是超级爱趴睡 ,2
172,趴着睡不撅屁股就没事 ,6
173,我们一撅屁股就要醒 ,6
174,撅屁股睡觉好像有什么说法吧？你去查一下 ,6
175,孙仙女的我看过好几部都演的特别好，长的又好看 ,2
176,以前是不是和亲爱的聊过孙艺珍，我记性不好 ,6
177,好像吧我记性更差她真的好漂亮，我当时看假如爱有天意好喜欢她 ,2
178,喝牛奶胃痛，又不爱吃肉，怎么补充蛋白质呢 ,6
179,蒙牛新养道0乳糖 ,6
180,这个牛奶不会胀气吗？我喝伊利的脱脂奶胃痛死 ,5
181,这是去看啥大型演出了 ,6
182,五彩文化广场的露天晚会，随便看，不花钱的。 ,6
183,我去了一次只有音乐喷泉啊 ,3
184,哈哈这是用啥的相机？ ,6
185,不是相机，焖饭那里拿得 ,6
186,好吧，我以为你自制的 ,6
187,用心做的事情都好让人感动 ,2
188,宝贝，你多久打到的车 ,6
189,你走了一会会  我就打着车了 ,6
190,咱俩都是幸运的 ,1
191,大晚上的怎么了？怎么还要拍片？不要着急，已经是妈妈了，要更坚强，这样才能好好保护你的心头肉。加油。 ,2
192,由于我的疏忽孩子着凉了！后果有点严重 ,4
193,这两天听到周围的三四个孩子着凉发烧了，温差大，要好好注意。不要自责了，看好宝宝要紧。 ,6
194,哈哈，明天才开始啊 ,1
195,是的，短信上讲5号开始我才注意看到。我到家了 ,6
196,嗯，我刚刚在打电话，嘿嘿，改天再约出来哈！ ,1
197,嗯嗯，今天那个芒果椰膏好吃！ ,2
198,这样啊老了老了受不起大声的音乐 ,5
199,我也吓坏我了心脏受不了 ,5
200,看来我还是弃了好了 ,5
201,早上6:35分在伪皇宫和东大桥中间坏了 ,6
202,但后来在吉林大路又停了不知道具体为什么 ,6
203,可能没修好，现在一坐轻轨都后怕 ,4
204,你太坏，放毒就不说了，偏偏在这个时候，让我恨你吗？ ,5
205,一起锻炼坚强的意志力 ,2
206,目前还在坚持，不晓得能忍好久 ,6
207,粉丝到底是个什么存在？？？周杰伦知道你是谁？？可悲，可怜！ ,5
208,哇，现在只要是偶像不知道自己存在，都不好意思成为粉丝了?那大天朝几亿人真是混得差啊! ,5
209,不要自己和其他人混为一谈。 ,5
210,我后天有小测昨天做梦梦见僵尸狂叫我写试卷吓得我直接醒来 ,4
211,哈哈哈哈哈什么鬼，脑洞好大 ,1
212,考前焦虑每次快要考试就紧张梦里的内容都充满了压力 ,4
213,全家团聚的神马最开心了 ,1
214,哈哈！是我外公外婆这边儿后面三幅字画最右面一幅是我外公自己写的 ,1
215,给跪了、、大师啊！你有没有遗传到哈哈~祝两老福如东海寿比南山哈！ ,2
216,看到你很开心，很幸福，我也觉得好幸福。希望他十年如一日地爱着你！恩爱一直秀下去 ,2
217,好我努力他也努力我才想看你一直开开心心快快乐乐的 ,2
218,放心啦，我会很开心的，你不用担心我，好好经营你自己的感情就是啦！好久没看到你了，想你了。 ,2
219,咋啦不喜欢他了？ ,6
220,淡了很久了。 ,3
221,天了噜绝情的人 ,5
222,？？？？乍一看我以为是我跟你说的 ,6
223,你是好人，不会不照顾孤寡青年的内心的 ,2
224,哈哈哈哈哈哈哈孤寡中年吧 ,1
225,你跟他一样的货色！ ,5
226,有点好奇你什么时候学过骑马，貌似这是时尚白领的新潮流 ,6
227,是呀，之前都没听说过学骑马呢？这究竟是玩来着，还是为新戏准备呢，窦老师能告诉我们吗？ ,6
228,窦老师肯定说，那是秘密不能告诉你的。如果他真告诉你，我打赌到广东请您喝早茶啊！ ,6
229,窦老师最近会不会到上海来赛车呢？你要抓紧机会问问他呀！ ,6
230,所以回到我前面那条评论，我担心他不赛车，改赛马啦，我得回头找找上海有哪些骑马的地方喽 ,6
231,看过推荐这家！！ ,2
232,我们也是被推荐去的真的不错诶！！ ,2
233,哈哈哈好我要去离我超近 ,1
234,要早点去最好提前预约还有，就是有点小贵 ,6
235,垃圾egd真的废物bp两把都是大虫子老鼠不长记性 ,5
236,垃圾，懂？生活的不如意喷比你强的人？ ,5
237,狗腿子看到没又输了废物 ,5
238,真能走啊不说来贵阳么你人呢你人呢？？？？？？ ,3
239,谁叫贵阳不是港口？？快帮我在贵阳找要煤炭的，就可以去了哈哈 ,1
240,那来六盘水这边全是煤炭哈哈 ,1
241,甜的还是咸的呀 ,6
242,咸的，这边只有肉粽 ,6
243,嘉兴肉粽很好吃勒  嘻嘻 ,1
244,有点不尊重记者了 ,5
245,没事啦蜜蜂每个人表达自己观点罢了别太在意啦 ,6
246,还是有理智粉的 ,6
247,去他的滥情种，老娘看破了 ,5
248,好人还是有滴。正向你走来呢你要相信。 ,6
249,昨晚是我来协和第一次失眠！我不懂是好的还是不好的征兆 ,3
250,偶尔失眠正常啦没事。看来是白天过得太轻松了 ,6
251,也许是因为昨晚看了高度帅的照片的缘故 ,6
252,该死的，有人说减肥不买泡面，哎 ,5
253,该死的，是你不让我去买的 ,5
254,该死的，是我叫你买你不买的 ,5
255,张的好就是不一样啊 ,6
256,怎么会不一样啊～～ ,6
257,长得好惹人喜欢、惹人爱啊 ,6
258,我觉得我所有的皂片都正常美丽动人冰天雪地人景合一！ ,2
259,嗯呐，尤其是和黑蒙古包的合照，更是衬托你的气色红润万人迷，看了你的照片也是醉了 ,2
260,觉得不能一起愉快的玩耍了 ,3
261,同感同感同感！！！ ,6
262,其实一周只有周末我才有状态哇哈哈 ,1
263,我也是啊，tmd，我发现我现在周一到周五上课上得比大学还积极，大学偶尔还有一两天没课的时候！ ,5
264,你是演妖怪甲还是乙？ ,6
265,这都被你猜中了最主要的是还剩两天，现在还在加班做提案 ,6
266,悲催，为虾米你就不能演个葫芦娃呢？ ,3
267,依旧做俊发·····我也觉得我适合演葫芦娃，可就我一个窜角的话太抢戏了··不妥哈哈 ,1
268,贵阳得？有啥子不妥？我觉得妥妥得，演三娃，刀枪不入！ ,6
269,我就一个问题博主去丽江被当地人民强制坑了多少钱？ ,6
270,你有被强制坑的类似经历？ ,6
271,嗯想起来都恶心  以后绝对不会再去云南 ,5
272,摔倒了自暴自弃也是一种选择 ,6
273,有钱头寄点给我吃吃啊 ,6
274,你还喜欢吃甜的啊 ,2
275,我一直喜欢吃甜的 ,2
276,这款实在太喜欢了，地台超棒的，可惜我还没有，而且太贵了，15也没提升多少嘛 ,2
277,dx15提升的小细节不少，半植发，新款地台等等吧，而且预订也才1400左右，对于没入dx06的玩家来说还是很好哒，期待下 ,2
278,嗯嗯。15预订了两个，价格这次很亲民，06-15都是帅b啊，各有好处 ,2
279,我老公今早就被贴条了。就差六分钟。nnd ,5
280,帮你画圈圈诅咒丫的 ,5
281,没错！主要是一排车就贴了他一辆。挑着贴的！ ,5
282,这男的太可恶了 ,5
283,是很可恶，想起来还会心有馀悸。 ,5
284,多危险啊。万一后面还有车开过来后果不堪设想。 ,4
285,是哇还好女孩命大后面没有车有车你我现在也不会成姐妹了 ,4
286,啊?!这个女孩是姐姐这男的更该死了！ ,5
287,家培哥，不要伤心！你这么优秀公司舍不得勒…开心点，什么都难不到你！加油 ,2
288,优秀？？？优秀就不会考不过。 ,3
289,运气问题，老师发现桌面有题库了！一次考试又不能说明什么，不要气了，以后还有很多的检查航班需要你！ ,2
290,今天第一次看到你，感觉很不真实，全程一直看着你，却还觉得时间太少，以后还要再见你！ ,2
291,小叶子长得和电视上一样吗？ ,6
292,一样啊，看上去给人很舒服的感觉，就是觉得他好累，挺心疼的。 ,2
293,自己抓个人参不就得了 ,6
294,哪有人参让我随便抓的道理啊 ,6
295,有呀，那么大个六盘山难道还没有一两颗千年老参嘛 ,6
296,老女人   哼 ,5
297,那你明天还要见老女人吗 ,5
298,要啊，我就喜欢比我大的 ,2
299,啊，我去过那，陪朋友去喝中药，每次我都会抢着喝一点，简直是有病 ,5
300,对对那的工大美女到是挺多的 ,1
301,你是怎么了，中药都上了 ,3
302,呃一点点比较麻烦得病嘻嘻嘻没事的 ,1
303,哈哈哈哈哈来北京来北京我在北京等你 ,1
304,到时候请来我的格调loft陪我住（也不知道我能不能租的起啊哈哈哈 ,1
305,我真的超想你来北京！！因为觉得咱们肯定会很合拍一起吃吃喝喝聊聊干嘛之类的哈哈哈 ,1
306,正常丫，智齿都这样的 ,6
307,什么是智齿会痛吗我怕 ,4
308,发炎就痛，有些人痛有些人不痛，反正我四个长完就没痛过 ,6
309,你的粉丝增长好快，6000多了。好。 ,2
310,发原创文章就增长得多点…也是您早期转发给带出来的 ,2
311,还是你勤快，我的真粉也就那么多。 ,2
312,捧臭脚从台下捧到台下了，捞金组合无耻到家了根本不配做音乐小丑 ,5
313,我做不做音乐跟你有半毛钱关系，别那么累好吗？我好得很，您就别关心了谢谢啊。 ,5
314,我又没说跟我有关系只是从节目可以看出来人品差 ,5
315,男神总艾特非粉或者生粉、这些熟的一次机会都不给是不是 ,5
316,编号618你满足吧，昨天都回你了。哼 ,5
317,今儿不是没回么、他一天不理我、总感觉跟个事儿卡心里一样 ,5
318,你们快点去参加我在这里祝福 ,2
319,妹纸们可得多支持哦～ ,2
320,我是想去我不在那几个城市。放心小护，点映已阅。开始二刷三刷… ,6
321,西安没有红花会的成都有 ,6
322,哦哦，好的，谢谢啦。我想着红花会在西安，所以应该也会有一些演出可以看，所以问问，最近才跳进坑，不是多么了解 ,6
323,他们签的公司在北京的。不过下半年应该会有很多演出的 ,6
324,遇到这种事先打电话打给能第一时间到的朋友。女生晚上一个人还是要早点回家 ,6
325,真的有血泪教训了我还是要好好在家给你们写春联比较好 ,4
326,思想觉悟顿时提高总之没出大事就好 ,6
327,亲也长智齿了么!我也是! ,6
328,去年长的，拔了一颗现在。要去拔啊你应该 ,6
329,一开始好痛，医生给我消炎后不痛了，说没再发炎就尽量让它长 ,6
330,恭喜啊！能回家过年了！ ,2
331,是啊…你呢？不会回不了家过年吧？… ,6
332,我们过年不休息，但是我申请在沈阳飞一个月，就能回家过年了。 ,6
333,是我喜欢的元素 ,2
334,平跟的很舒服 ,2
335,你的身高不用高跟了 ,6
336,怎么了  心情不好啊 ,6
337,多多这个大坏蛋自私的要死 ,5
338,只买他想吃的不买你想吃的 ,5
339,哈哈一大早被你这梦乐醒了 ,1
340,哈哈其实还有好多细节呢我看见这位艺术家的工作室挺大明亮又宽敞还有中秋节的月饼盒子一米多长…哈哈我醒了也笑了 ,1
341,怎么会做这样的梦？潜意识里你想跳槽？ ,6
342,我为你的荷包感到担心 ,4
343,我就这点爱好了 ,6
344,哈哈哈哈哈所以每次张文宝说我花钱我都说你然后他就不说了 ,1
345,周末回来经常聚聚吖可以相互分享一下败家心得哈哈哈 ,1
346,哈哈哈哈哈可以有～估计张文宝以后和你们聚就不会带我了 ,1
347,真心希望他俩能好 ,2
348,黑粉太多，真好了还会被骂 ,5
349,黑粉估计都是脑残粉，我真搞不明白，别人谈个恋爱他们着什么急，难不成把他们搅黄了，还能娶他们不成 ,5
350,太太你们需要排版吗？？！！ ,6
351,需要校对！！！qaq ,6
352,qaq这边不做校对，可惜惹 ,3
353,实在不理解喝醉了撒疯的这些人喝醉了要不就是还有思想要不就是短片啊哪有那么多别的想法 ,5
354,这就是我不喜欢喝酒原因 ,5
355,对呀喝醉酒要么是断片要么就是还有意识只是借着酒精撒疯而已 ,5
356,哈哈哈…好好笑。假如不对称的话那就是瑕疵的美啊… ,1
357,看样子今天不会落枕了 ,6
358,哪有人希望自己落枕的… ,6
359,明显我开玩笑的啊，哈哈 ,1
360,那这算冷笑话么？ ,6
361,希望不要冻着你，呵呵 ,1
362,好巧我也收了宠猫跟彩虹糖不过都是薄荷色 ,1
363,好有缘。感觉彩虹糖黑色百搭一些入了黑色 ,1
364,哈哈哈彩虹糖选色当初纠结死我了因为觉得好多颜色都可爱 ,1
365,重大!!!以前最喜欢去吃饭然后散步的地方!!!好想念!!!你也算是川美熟人了哈哈哈哈 ,1
366,重大真的是最有大学氛围的，宽广大气，当然我还是对川美最有感情，毕竟，我也算是川美家属了 ,2
367,而且重大食堂也好吃!!!吃完湖边散步简直太安逸!!! ,2
368,我今天去了哦就是站最前面正中间短发那个女生！记得我吗？超级喜欢你！唱的特别棒加油 ,2
369,是戴眼镜的那位吗？谢谢你 ,1
370,嗯嗯对啊对啊加油啊！特别喜欢你！期待你的新歌！ ,2
371,就吗也会逛街？？？ ,6
372,而且还是自己一个人的we厉害咩 ,2
373,得窝哦【不带小植树去你个就吗怎么当的 ,6
374,所以，还是那句话gay逼们赶紧找到真艾，美美滋滋 ,5
375,诋毁别人，你也好不到哪去 ,5
376,说的gay狗跟个人一样 ,5
377,看了择天记真心觉得娜扎颜值好高阿   还不错的女孩儿  就是不知道为什么那么招黑 ,2
378,择天记她戏份好少，都是落落戏份比较多，不知道后面会不会多一些。 ,6
379,应该会多一些吧  好喜欢长生容儿   爱上娜扎了  太美了 ,2
380,美美哒！性格又好！ ,2
381,不到一个月你就找了小学妹我还在反思是不是我做的不够好 ,3
382,是不是你的桂花糕没捂热 ,6
383,他不爱吃桂花糕 ,3
384,他只是不喜欢吃你送的桂花糕 ,6
385,他和你什么关系呢？ ,6
386,没关系了，在一学校贴吧问真题，后来加的他，之前说过几句感觉还没啥，今天就这样了 ,6
387,你还是好好自己做题，问老师吧亲！ ,6
388,我要买他们学校的真题啊，要不然专业课不好弄。 ,6
389,？？？？？？您孩子麻烦以后别送到中国学校 ,5
390,这和中国学校有什么关系。不要带节奏好不好。我仅仅只是吐槽一下。人民教师的行为只是个人行为。与学校并无瓜葛。 ,6
