,text,label
15756,厉害咯，我家清明都是买青团，还没有自己做过。 ,2
15757,以前都是买来吃，以后就自己做来吃，其实挺好做的 ,2
15758,做甜品和小点心，你是真厉害 ,2
15759,好用不？是他们给用完的 ,6
15760,好用啊，不油的，适合油性皮肤。 ,6
15761,多少钱！！！有用不？ ,6
15762,我们这边太惨了，我们决定明晚吃泡面 ,3
15763,咋地了食堂不好呀？ ,6
15764,明天晚上吃泡面  连个像样的超市都没有啊 ,3
15765,不提和iphonex的对比，就3288这个价格能买到mix2还是蛮实惠的。如果没有入ios坑，还是很有购买欲的。 ,6
15766,能像iphone一样随便买再说 ,6
15767,所以我说“如果”能花3299买到的话 ,6
15768,希望如你所愿。其实我也挺想买 ,2
15769,凝固用的吉利丁片嘛？ ,6
15770,可以用，也可以熬棉花糖，或者熬qq糖 ,6
15771,我觉得那样做出来的不好吃 ,6
15772,还中不中了呀， ,6
15773,肇事者连声谢谢都不说，（破了点皮） ,6
15774,不过还想知道你当时作何反应呀，嘿嘿 ,1
15775,我给摆摆手，让他走了是不是可不出气 ,6
15776,今天看见了彩虹哎 ,6
15777,这么热的天还能看见彩虹？一般不是雨后才看得见彩虹吗 ,6
15778,对下了一点小雨 ,6
15779,那很幸运啊！许愿了吗？ ,6
15780,厉害了这个小学弟 ,2
15781,看着不声不响，撩起来太可怕了… ,6
15782,颠复了我对程序员的看法 ,6
15783,这奶瓶好棒啊！哪搞来的？ ,2
15784,石家庄小店淘得，朋友付款，这是一对，她还有一个奶嘴 ,6
15785,淘宝搜到了。还有磨砂表面和金属表面两种。好可爱～ ,2
15786,一次性搞定好，昨天我带hummer去办护照了，累趴 ,3
15787,是阿，护照5年有效，到时就直接可以带宝宝出国了 ,6
15788,早知道我们那会一起也办了 ,6
15789,如果你和娜姐没分开，那绝配阿。 ,2
15790,谢娜配不上他，个人想法。 ,6
15791,没有分开，就像孙丽和邓超。马伊莉文章、娱乐圈红透的两夫妻。多好阿。 ,2
15792,你是最好的！ ,2
15793,我会更加努力的！ ,2
15794,不用努力了！别累着！已经很好了！ ,2
15795,小时候烫伤用牙膏和薄荷叶 ,6
15796,我都疼了快一天 ,3
15797,去诊所看看，别伤口感染了 ,6
15798,没有破，就是超疼，大概内伤… ,3
15799,好滴～我估计快起飞了～咱俩都一路顺风哈～加航的空姐是妈妈级的 ,2
15800,妈妈级的话，会照顾人嘻嘻~到了告一声报个平安 ,1
15801,嗯到了~昨天没有连上wifi ,6
15802,准备去看刚看完夏木 ,6
15803,夏木？啥？好看么？ ,6
15804,夏目友人帐，超好看～ ,2
15805,你不会又带了我们大二班吧 ,6
15806,我居然带的是13班噢耶 ,6
15807,还有13班。一定是重点班吧。3-1=2也行。 ,6
15808,是的呀对3-1哈哈怀恋老二班 ,1
15809,。好怀念啊。亮总说的我能考上大学。我还真考上了。亮总看人好准 ,6
15810,以后记得常回九中看看 ,6
15811,句子出自我，不过毛笔字我揾肥仔哥代劳···原谅我吧··· ,6
15812,"估到肯定系某个大师出手架啦.不过翻嚟见到你地d对联,真系笑到我地lei低咁制 ",1
15813,饼干牛奶大蛋糕…呢个笑死我 ,1
15814,肯定是你要求太高了吧 ,6
15815,不是我的要求问题，我不对任何人提要求。我只是作为一个独立的人对另一个独立的人的看法 ,6
15816,不能相信啊！感觉你眼光高，肯定挑的人没问题。 ,2
15817,人都有优点和缺点，他优点和缺点都异常突出 ,6
15818,我靠！可爱啊啊啊！恭喜毕业! ,2
15819,谢谢！！！我终于脱离苦海了！！！我要爆睡几天！！！ ,1
15820,哈哈哈哈哈哈好好休息!!! ,1
15821,好漂亮！！！ ,2
15822,deideidei！超好看！五色海也好看！ ,2
15823,你是最近一直在旅游吗？好想知道这个颜色怎么形成的！ ,6
15824,什么技术？传谣是要负责的，呵呵 ,5
15825,你自己不会点开链接看的？ ,5
15826,看了，没写明白什么技术 ,5
15827,你善良哦，祝大家考不上 ,5
15828,中国研究生选拔的是高等人才是能辨别是非黑白的。如果一些人连这种思想都没有，考上也没用。你自己何必对号入座呢 ,5
15829,就你这语文水平，哈哈哈，我对号入座了？大家又不是我 ,5
15830,大家也许是在炸你 ,6
15831,炸我啥了，并不是 ,6
15832,就是说要报哪，最后不一定就报那个啊 ,6
15833,学硕怎么可能随便换学校 ,6
15834,不是换，我意思是人家说一个压根就没打算报的，其实是别的学校 ,6
15835,又不是人家当我面说的，是老师统计的 ,6
15836,又有点喜欢又有点累扎心了老铁但是我已经转行了，护理其实是个不错的职业 ,3
15837,！厉害了！羡慕 ,2
15838,不要羡慕，转去了一个只有海龟博士才能找到工作的专业总觉得未来还是会干回护士 ,6
15839,之前我姐姐给了我几个那个小瓶瓶的东东他说那是洗脸，到现在我一直没用！因为我没弄清楚是啥。 ,6
15840,洗脸的？你很明智，还好没用，现在可以拿出来用啦 ,6
15841,我也忘记他说的啥啦反正是往脸上使的她说 ,6
15842,哇好土豪的样子我看到那个小篮子了哈哈 ,1
15843,哈哈，报告！小篮子成活率100%，而且都长高了，鼓掌吧！哈哈～ ,1
15844,夸你！有时间看个特写有出颜色了吧 ,2
15845,坑！！！送我虐暴杭职！ ,5
15846,大哥你确信，你能行？ ,6
15847,废话，就我这技术都能虐一个系！ ,6
15848,我现在也是脑子里只有刷题考试谈什么恋爱！题刷了吗！ ,6
15849,哈哈我也是，活得比男人都累 ,3
15850,然后每天都焦虑的不得了 ,3
15851,恩我也焦虑，想的特别多，然后就忧愁的不要不要的了 ,3
15852,有句俗语叫家有一老，如有一宝。感觉真的很贴切 ,2
15853,失去后更有感受 ,6
15854,我也失去过外公和爷爷，那时还小，感觉都快哭傻了 ,3
15855,还健在的要倍加珍惜啊… ,6
15856,对好人好是没错的，不用担心别人是否记得，因为好人会记住的。 ,6
15857,"我不是希望谁记住,?只希望有人也可以对我好点. ",6
15858,对别人好的话别人也会对你好啊 ,6
15859,因为alu喜欢上了红色 ,2
15860,为什么我也看着是红色 ,6
15861,是那种橙红色加上滤镜或者啥的看就是红色的 ,6
15862,在婚姻里，物质和爱情都是必需品，看你觉得哪个更重要一些罢了。 ,6
15863,最近听很多已经结婚的人说，他们其实都是在将就的生活着 ,6
15864,不是吧，我身边也有这样的，不过很少。大部分都是因为爱情结婚的，就是经济没那么好。 ,6
15865,结婚是因为爱情，但之后的生活确是在互相将就与包容 ,6
15866,似乎要比对自己逼婚的人好点儿。 ,6
15867,我要有你这觉悟我娘也放心了 ,6
15868,觉悟是不够的。需要行动起来。 ,6
15869,你什么时候上来给我聊聊具体要行动啥 ,6
15870,图和话嘛关系。盗用书名。 ,6
15871,你没看过，章子怡说了这句话，我瞬间哽咽。 ,3
15872,这是书名啊！怎么又从她嘴里说出来了？ ,6
15873,表示很感兴趣，可惜不在重庆呜呜~祝你早日征到球友哈~ ,2
15874,你不会是看了网球王子才有的兴趣吧，哈哈 ,1
15875,bingo~多么了解我哈哈~ ,1
15876,惊呆了！我惊呆了！ ,4
15877,哈哈哈！！！入戏太深！！！ ,1
15878,难道你和我想的完全不是一码事？！？！ ,6
15879,你在想什么我怎么知道！！！你喜欢小矮子！可我喜欢慕容云海！！ ,2
15880,呸，小矮子听到把你碎尸！你表想了，古丽二娃已经在磨刀了 ,5
15881,娘娘是独一无二的美娘娘 ,2
15882,她是你的娘？到处认娘有劲吗？ ,5
15883,哎呦呵厉害了哥，何炅还叫过她娘娘，您老倒是说啊 ,5
15884,一觉起来看到你的祝福，开心到飞起好不好 ,1
15885,小仙女!早上好! ,2
15886,你的小仙女现在饿着上英语课 ,6
15887,我还没吃饭刚起床 ,6
15888,摸摸头我喜欢花嫁那套 ,2
15889,是的那套超好看 ,2
15890,嗯嗯，感觉洛天依两套白色花嫁都好看，还有古风的那个~ ,1
15891,唉可惜没空也没钱了 ,3
15892,几时请吃饭庆祝一下 ,6
15893,实际上应该是你请我才对。 ,6
15894,讲点别的好咩，有拐了应该隆重介绍 ,6
15895,主题是什么，说我是男神，还是说你的男神是我的老婆 ,6
15896,主题是、你老婆真美 ,2
15897,这个主题最没意思了，一点都不劲爆 ,6
15898,那我怎么回答才比较劲爆、然道我要说、你老婆好美、一点也看不出来奉子成婚、真机智 ,6
15899,姗姗没帮啊，她是被利用的 ,6
15900,不是她把人家带到花房的吗，我感觉她知道凶手是谁，不理解她的动机 ,6
15901,她是因为警察说她老公出事让她带她去散散心的 ,6
15902,我是为了在成为圆滑的大人以后多骗几个小妹妹的春夏秋冬 ,6
15903,还是上面那句话  送给你不要激怒一个佤族就像不要勾引一个吧女我就是那个佤族 ,6
15904,我也送你一句话，不要威胁一个傣族，就像不要抢劫一个阿旺 ,6
15905,我今晚看的夜场超级搞笑！！幸福～～ ,1
15906,跟谁看的？？哈哈跟泰囧一个路线啊～ ,1
15907,我在西安～和老马和两个朋友 ,6
15908,亲爱哩，你可以拿回观音桥兑换 ,2
15909,我们城口独立老的'不需要'城口人是有骨气的 ,6
15910,亲，我可以说你不要小心眼了吗 ,6
15911,什么鬼，你不是一直做unity的吗 ,6
15912,之前gm后台大数据缺人先调过去做了2个月大数据 ,6
15913,那是真的有点惨了，欢迎回归客户端 ,6
15914,今天才看见你说要爬墙？那现在回来了吗 ,6
15915,现在还没有现在在熊老师家里 ,6
15916,是什么让你爱上了他 ,6
15917,这老师听起来很不错嘛俺们宿舍昨儿还说要去蹭法语来着呢，额，歌很好听哟 ,2
15918,法语课？咱们学校的吗？老师挺有诚意的，很喜欢 ,2
15919,是啊，发展10的，专门给他们开的哦 ,6
15920,注意身体…我发烧了…还能再杯催么？… ,3
15921,你那心情压抑，能不病么，好好放松下吧。 ,3
15922,怎么放松哦？…还来大姨妈，真是抵抗力最低的时候了 ,3
15923,"这是哪个神人拍的,求人肉~ ",6
15924,不能暴露。我是守信用滴:-p ,6
15925,谁这么关注小越越啊他会高兴死的 ,1
15926,不能叫他越越，这个名字有人用了。人家是觉得你们这样听人讲课比较经典。重点在画面。 ,6
15927,重点是出现了化妆二字而不是花露水 ,6
15928,现在出门不化妆简直是灾难，多少要抹点东西 ,3
15929,恭喜你成功的给自己添加了一项支出 ,2
15930,许昌有什么好吃好玩的没！ ,6
15931,都是好吃的好玩的哈哈来吧 ,1
15932,不能引诱我啊，我可是大吃货啊 ,6
15933,十万个同意！！！！ ,6
15934,我第一次觉得英文那么恶心看到感觉看的是一堆符号，快要吐 ,5
15935,离开了谷歌翻译我根本无法写文章 ,3
15936,我得裙子有没帮我一起解决。 ,6
15937,秋娟不是说物业不给，我怎么解决 ,6
15938,你明天帮我再去问下。你电话拿给他。我来讲。死物业得 ,5
15939,哇，好可爱啊感觉舍不得下口，太可爱了！ ,2
15940,我觉得肯定太难吃所以很果断的下口了结果意外的好吃 ,2
15941,哈哈哈哈原来如此不过好吃就好 ,1
15942,可怜啊，我们下午考完就放假了。 ,3
15943,你也会有要上班到大年三十的时候的 ,6
15944,是的，所以现在要好好珍惜我美好的校园生活。 ,2
15945,好好珍惜不要光耍嘴皮子 ,2
15946,哈哈，为啥子是交通银行？ ,1
15947,。我们学校唯一的自动取款机。 ,6
15948,额，好嘛。生活费到账了哇?你好爽嘛，一个月银行要进两次帐 ,6
15949,cya!保重保重。一路平安 ,2
15950,你认真写歌咯！我到时候要验收啊 ,6
15951,验收你个球球，到了没有咯！ ,6
15952,才到学校咧！累到想死好不 ,3
15953,哈哈哈哈哈被流口水萌到了！ ,1
15954,其实是躺着一边吃一边睡，然后他把菜汁擦在了垫子上 ,6
15955,以后有机会能让我见见它吗 ,6
15956,感谢充电器最后45码的圣诞礼物 ,2
15957,进射程左右的位置之后三个档打的都乱套，最后特勤组上的太仓促了 ,6
15958,天助我大布朗，今朝破蛋，下赛季浴火重生，拳打钢人乌鸦，脚踢渣爱酋长，横扫美联，勇夺sb就问你怕不怕 ,6
15959,您一直白内障来着？恭喜康复啊 ,2
15960,准是被你带坏了 ,6
15961,啊？不管我的事啊 ,6
15962,白夜行是啥子鬼，好看不 ,6
15963,东野圭吾的成名作，我境界不高，我觉得一般般，哈哈 ,1
15964,哈哈，啥时候这么谦虚了，不像你的风格哦 ,1
15965,快快改名字吧？这个名字差评 ,6
15966,干嘛改名字？这个名字挺好的，简洁明了的表达了自己的观点:支持马蓉。 ,6
15967,哈哈！这需要多大的心脏呀！ ,1
15968,心如太虚，其大无外，其小无内。在外，可纳百川大海；在内，不容点点浮层。 ,6
15969,想上10组快攻骑阿，上个月15到10我都连胜上去没用上半小时 ,6
15970,想玩贼想玩有趣一点的卡组 ,6
15971,效率上分和有趣兼得就很难了 ,6
15972,他的眼睛能恢复吗 ,6
15973,说不好。要看脑部修复程度 ,6
15974,概率多大呢？我看到孩子的遭遇，我感觉我都要得抑郁症了 ,3
15975,那就睁着眼睛选！宝贝为了我们能聚起来你牺牲一下吧！ ,6
15976,不是说你开车来青岛嫁我吗？童话里都是骗人的了？ ,6
15977,你得记得我的外号是善变啊亲 ,6
15978,我肠子都悔青了~要不是这坑人的东西我们早就在家嗨了一个多星期了啊～ ,3
15979,我现在真是欲哭无泪！ ,3
15980,我也是～真的不想读了。算了。 ,3
15981,真的要回去好好想想商量一下了！ ,3
15982,恩啊～而且这次不回去也是个错误啊～ ,3
15983,我急急忙忙的来才是个错误！不美丽的错误！ ,3
15984,我只想说你傻啊～ ,3
15985,婚姻就像鞋子，合不合脚只有自己知道。 ,6
15986,祝你的鞋子又美又合脚~ ,2
15987,享受赤脚少年好时光ing ,6
15988,我觉得你妈妈特别有气场！ ,2
15989,真的呀，嘎嘎，看着厉害吗？ ,2
15990,不是厉害，但是就特有气场，这是大家一致的看法，都说妈妈一定是领导！ ,2
15991,我有个同城圆通件，倒是很快～第二天上午就到了 ,6
15992,气人呢？今天逛街看见羽绒裤卖，本想让胖子买给你，算了== ,5
15993,我之前的手机已经慢到家了，特别曲折的，已经苦到头了 ,3
15994,看到斯坦李那个觉得他很厉害 ,2
15995,直播的时候没听着，后来看视频集锦才发现，哈哈逗死我了 ,1
15996,有评论说，这叫委婉的说“我是你爸爸” ,6
15997,嗯嗯，相当委婉了 ,6
15998,这球场留下了遗憾 ,3
15999,嘻嘻没事下次再来不留遗憾 ,1
16000,哎毕业了要没机会了 ,3
16001,哪个背我过去我保证不分手 ,6
16002,哈哈，你是怕不答应被丢下去吧 ,1
16003,我是怕同年同月死 ,4
16004,好啊，哥的生日是农历八月份，记得给哥准备礼物哦。 ,6
16005,想要啥礼物？只要我能买起的，一个zhi买！ ,6
16006,嘿嘿，要你一生幸福就足以。 ,1
16007,不是会员了发不了图表达不了我滴心意！！ ,6
16008,不是很有钱吗不是在看live吗没钱充了吗可笑死了发呀发呀发呀 ,5
16009,我们有钱人会员到期就在不充了我嫌  破烦滴很！ ,5
16010,觉得有朋哥刻意避着心如，这么好的盆友，从来连一个转发和评论都没有 ,6
16011,怎么可能避，你没刷到他去参加庆功宴了吗？ ,6
16012,没有，也能看到他发和心如一起的照片，心如发了，他也没有转发 ,6
16013,十分欧了…我玩了大半年现在才两个s女武神 ,6
16014,这游戏那么不友好的么 ,6
16015,主要我没怎么氪啦哈哈哈月卡党… ,1
16016,刚在小区看到两个好漂亮的女孩走在一起，可我不敢上去搭讪 ,4
16017,女生是看不起胆小鬼的 ,6
16018,你在说b话？？？ ,5
16019,你爱这个女人的很特别是金粉世家对不对 ,6
16020,金粉世家简直是一生挚爱！ ,2
16021,恩哈哈就是感觉你很中意她勒 ,1
16022,啊啊啊！噶瘦了啊！你厉害的！居然做到了 ,2
16023,还好咯…我原来就这体重啊…又不是100斤，100斤才难 ,6
16024,你人高呀！100斤太瘦了！恢复到孕前真是指日可待！ ,6
16025,带娃累啊⋯莫名其妙就瘦了 ,3
16026,希望我耶可以瘦下来！还有我觉得你关键嘴巴不馋！吃的东西也健康！ ,2
16027,不馋是真的…每天带小孩没空馋 ,3
16028,我又看了一下你的分析居然拿转发数据来说话再怎么说三千万的粉丝就看不转么 ,6
16029,我不是任何人的粉，两个人都不是。吃瓜群众一个，只发自己的意见。 ,6
16030,然后我指出了错误 ,6
16031,那不好听的呢？ ,6
16032,不好听也没什么啊，我就一般啊 ,6
16033,我不会唱。不在调 ,6
16034,也许回忆的不是那个人，只是他出现在了你幸福的日子。 ,6
16035,所以渐渐的   我就要对他不忘么 ,6
16036,幸福是你的，跟谁在里面没有关系。 ,6
16037,小纯姐你在四川？四川欢迎你！！！！！！！！！！！！！！！ ,2
16038,哈哈！！四川好好玩！姐决定还要再来一次！！尤其是当美丽姐在这的时候～～～ ,1
16039,好的咧！好早啊，小蠢姐。 ,1
16040,哎哟喂  话说咱有时差不～～ ,6
16041,貌似很好吃的啊 ,2
16042,尝了红豆的，味道还不错 ,2
16043,我好像以前也吃过，我蛮喜欢的 ,2
16044,我想不起来我们小时候有的吗？我也好像记得，有奶油的，很好吃 ,2
16045,是的，超级不错的 ,2
16046,可惜现在都找不回以前的味道了 ,3
16047,三个问题一个都木有回复 ,6
16048,什么问题啊？再发一次。 ,6
16049,第一个高数过了没，第二个喜欢哪个亚洲女明星，第三个微薄那个什么表白玩过伐？哈激动，谢谢！！！ ,1
16050,今天日子有点好哦，我今天也在绵阳参加婚礼 ,6
16051,我大姐又粗嫁啦然后糖糖下个月 ,6
16052,哎呀，你们家喜事真多。恭喜恭喜 ,2
16053,那个小兔子超可爱啊！ ,2
16054,哈哈哈像我吧（臭不要脸） ,1
16055,哈哈哈哈你比她可爱！ ,1
16056,黑怕不怕黑，怕红，中国不存在hiphop ,5
16057,照你这么说嘻哈就只有低俗了？自己给自己贴下等标签 ,5
16058,又一个不看我评论的，我说了，嘻哈不是低俗，但包含低俗，就像人一样，难道要把俗人都封杀弄死吗？ ,5
16059,安全第一，以后出门备好救生衣和小锤子。祷告！愿主与你同在！ ,2
16060,谢谢老师！我刚才一直在祷告！现在下小了！感谢主！ ,2
16061,耶稣会怜悯我们这些需要他的人，因为我们信他，感谢主，以马内利！ ,2
16062,下次请我去嘛，我勉强点陪你，你会为身边有我，这个大美女而骄傲的。 ,2
16063,我怕没车送你回赤坎，半路被人劫色的话，岂不是要负全责？ ,6
16064,没事，最多就要你付一半责任，另外一半主要是因为我太漂亮了，这部分责任不怪你。 ,6
16065,这样说的话，我觉得我毫无责任咯。 ,6
16066,还有我发现了你是内双 ,6
16067,就是内双  很美！ ,2
16068,电眼哎呀闪瞎我了啦 ,6
16069,闪瞎你得了啦 ,6
16070,怎么觉得随便照都好美！ ,2
16071,是的！都特美但我真的不是随便照的 ,2
16072,给人一种随手一拍的感觉是摄影的最高境界了我夸你呢 ,2
16073,贾总，我的手机到底还能不能拿回来了，还有没有可以解决事情的了？ ,6
16074,您好，抱歉给您带来不便，团长这边已为您催促，工作人员会尽快处理 ,6
16075,永远都在催促，售后都没收到催促的消息，一点实质方法都没有，只会说抱歉，有什么用？ ,5
16076,这个肉蒲女神看起来好好次 ,2
16077,无辣不欢人士必备小零食 ,6
16078,无辣不欢好符合我的气质网上买的？ ,6
16079,朋友发我的微信号，店主长沙人，她家有tb店乖，雅食荟。 ,6
16080,我都要finish了！太赞了！！#喝光=说服力# ,2
16081,我也快完了，越南人民真是我的至亲！ ,2
16082,因为我拿了10包！哈哈哈哈哈 ,1
16083,"好萌`,是游戏么`?? ",2
16084,嗯嗯，叫云妞，特别可爱超好玩。 ,2
16085,"看画面就很可爱`, ",2
16086,小鸟还会唱歌哦，你下一个玩吧！ ,2
16087,我之前买了他家管状的粉底，还没用呢！这个如何？？ ,6
16088,真爱，我觉得好好用 ,2
16089,不知道和管状有什么区别呢。cpb的都很好评，持久度好像比较高 ,6
16090,嗯我现在用ysl不如cpb果然贵有贵的道理 ,6
16091,女林桀骜cp即将在太后成为情敌 ,6
16092,后来出现的那个男的是他演的？ ,6
16093,我猜刘亚仁客串的就是那个润基欧巴 ,6
16094,好有爱啊哈哈学长表情好逗 ,2
16095,哈哈是吧他一直这么洒从未被超越 ,1
16096,你竟然也没睡呢啊这么晚了 ,6
16097,那个奥特莱斯好好逛！！ ,2
16098,好多东西超便宜，真想逛到上飞机 ,2
16099,我上次盘了一个乐高回来，比国内一半还便宜 ,2
16100,我觉得可以把省的钱买机票飞到关西，买买买，然后飞回重庆 ,6
16101,这一趟耍安逸了哈，好舒服啊 ,2
16102,你本来就很漂亮好嘛！ ,2
16103,这九张里哪张最漂亮！ ,2
16104,都很漂亮第五张最美符合你独一无二的美丽气质 ,2
16105,这个厕所好大好大呀 ,6
16106,必须得大点，因为樱木屁屁太大惹，小的会把屎拉到侧壁 ,6
16107,我家猫猫也好大…折磨着过阵子也给他换个再大些的 ,6
16108,推荐你这个你就搜中恒就行我买的是圆顶大号比座便都大还挺便宜九十多 ,6
16109,怎么补？误买到学生票了 ,6
16110,…没听明白你状况… ,6
16111,不小心买了学生票，但是没有学生证了。能补全票吗 ,6
16112,绝望地发现今年没长进。 ,3
16113,没长进吗？中间的人像很好啊 ,6
16114,中间人像就掐了两张。一张不好。旁边是商拍摄影师，就算了。你看我今天抓拍的那个拿徕卡的姑娘。 ,6
16115,快回来了呦亲 ,6
16116,你们回去了没？回去的话好好看家哦 ,6
16117,天天都在宿舍苦等你们这群不爱家的坏人 ,6
16118,妈妈说，说谎话的孩纸鼻子会变长。还不睡美容觉 ,6
16119,您的身高已超出测量范围心疼我儿砸  人家就想要一米多有这么难吗嘤嘤嘤 ,3
16120,心疼我宝宝参加个节目，都暴露身高了，就想和大家一样当个1米多的宝宝嘛 ,3
16121,隐瞒了这么多年的身高之谜要被解开了我儿砸：我并不情愿 ,3
16122,我们这边也突然好多人买这玩意～不明所以 ,6
16123,好吧，可能开始流行修身养性 ,6
16124,可我倒现在还没弄明白那到底是什么生物！ ,6
16125,爸爸要去复读了，美术生伤不起，明年美院见 ,3
16126,也是正在复读中，并且希望在这一年中不要丢失了目标 ,2
16127,正是因为年轻所以就什么都不考虑往前冲，祝您明天收获满满，加油 ,2
16128,队长好帅噢…新赛季快开始了…要加油…永远支持男排… ,2
16129,先打全运行，新赛季要年底才开始 ,6
16130,好吧…哈哈…我其实不懂球…都是看队长的… ,1
16131,河马队长的魅力指数够高的，欢迎有空来卢湾体育馆给上海队加油去！ ,2
16132,看来吃货已经迫不及待了！ ,6
16133,大家这么期待是怎么回事！八字儿还没一撇呢 ,6
16134,哈哈哈！什么叫八字没一撇   你这梦做的  纳都呼之欲出了 ,1
16135,还是别拍的好，真的，你拍得都看不出好看 ,2
16136,哈哈哈哈我那么多朋友里就你最实诚！ ,1
16137,听你语言描述本来我想像得很漂的，但是一看相片 ,2
16138,哈哈哈我就随便拍拍不要对我要求这么高！哼 ,1
16139,单身和谁吃嘛！一个男人坐一桌看见别人的情侣在哪里吃吗 ,6
16140,一个人的火锅还没试过，可以尝试哈 ,6
16141,单身女性吃火锅要比男士吃火锅好点，不会那么尴尬 ,6
16142,她是喜欢才模仿呀。又什么，人家也是喜欢泫雅 ,5
16143,喜欢就要去抄袭？抄袭没错？抄袭者还要被受追捧哦 ,5
16144,这个只是表演吧。是她的新歌吗？发表新歌了吗？我是马儿粉 ,5
16145,本来觉得超美好喜欢，但一看是猛犸象牙，瞬间对价格感到有些绝望但是猛犸象牙代替象牙确实是更加人道环保 ,3
16146,您觉得猛犸象牙比现代象牙便宜？ ,6
16147,猛犸象肯定比象牙贵啊老铁 ,6
16148,也贵不了太多，主要看做东西的损耗 ,6
16149,呲胡辣汤不能搅拌哟稀了就不好次啦 ,6
16150,啊哈还是你专业呀！话说昨晚吃了个同盛祥好好吃啊！ ,1
16151,我没吃过哇下次去要去呲你是和酥酥阿姨去的捏还是谁谁谁亚 ,6
